{
  "id": "road-to-secret-wars",
  "title": "Road to Secret Wars",
  "titleAccent": "Secret Wars",
  "eyebrow": "Hickman’s Avengers → Secret Wars → everything after",
  "deck": "The full run in reading order, issue by issue. Tick as you go — progress syncs across every device. Use Edit list in the bar below to add, change or remove entries. Two conventions before you start. A blue row means two titles are alternating and this is the second of the pair. And a section named after a collection rather than a comic — Time Runs Out is the one that catches everyone — is a trade banner, not a series you can buy under that name; the note on each section says what it actually is.",
  "tagline": "Checklist · 616 × 1610",
  "progressWord": "convergence",
  "sections": [
    {
      "id": "s-000",
      "n": "000",
      "title": "Before the Beginning",
      "core": false,
      "flag": false,
      "note": "Secret Wars resolves this run as much as it resolves the Avengers one — same author, same era, and threads that walk straight into the finale. Around 65 issues, and widely held to be his best Marvel work. The numbering looks wrong twice here, and isn't. Fantastic Four (1998) is volume 3, which reverted to legacy numbering at #500 in 2003, so a series launched in 1998 is already up at #570 by the time Hickman arrives. And FF is not a rename: Johnny Storm dies in Fantastic Four #587, the title stops at #588, and FF — Future Foundation — launches in its place with the survivors plus Spider-Man. Fantastic Four then returns at #600 with Johnny alive, and from that point both books run at once, which is why the last row alternates between the two.",
      "items": [
        {
          "id": "000-dark-reign-fantastic-four-1-5",
          "s": "Dark Reign: Fantastic Four",
          "i": "#1–5",
          "note": "Hickman's 2009 audition, written before he took over the main title. Read it first even though the trades print it second",
          "alt": false
        },
        {
          "id": "000-fantastic-four-1998-570-588",
          "s": "Fantastic Four",
          "i": "(1998) #570–588",
          "note": "The run starts here",
          "alt": false
        },
        {
          "id": "000-ff-1-11",
          "s": "FF",
          "i": "#1–11",
          "note": "The replacement title, not a rename — the Future Foundation book that runs while Fantastic Four is off the schedule",
          "alt": false
        },
        {
          "id": "000-fantastic-four-600-611-ff-12-23-alternating",
          "s": "Fantastic Four #600–611 / FF #12–23",
          "i": "alternating",
          "note": "Both titles run at once from here, so they interleave: F4 600, FF 12, F4 601, FF 13, F4 602, FF 14, F4 603, FF 15, F4 604, FF 16, F4 605, 605.1, 606, FF 17–18, F4 607–608, FF 19–21, F4 609–610, FF 22, F4 611, FF 23",
          "alt": false
        }
      ],
      "collected": "Fantastic Four by Jonathan Hickman: The Complete Collection v1-4 (2018-22). v1 = Fantastic Four #570-578 + Dark Reign: Fantastic Four #1-5 - v2 = #579-588 + FF (2011) #1-5 - v3 = FF #6-16 + Fantastic Four #600-604 - v4 = Fantastic Four #605-611, 605.1 + FF #17-23. Watch out: the trades place Dark Reign after #570-578, not before it as the order above has it. Also collected as two Hickman Fantastic Four omnibuses."
    },
    {
      "id": "s-001",
      "n": "001",
      "title": "Incursions & Avengers World",
      "core": true,
      "flag": false,
      "note": "Two titles running in parallel: Avengers goes big and outward, New Avengers stays with the Illuminati. Don't trust either name. Avengers (2012) is volume 5 and New Avengers (2013) is volume 3 — both have been relaunched so often that the year is the only reliable way to identify them. And New Avengers here is not a team book at all: it is the Illuminati — Iron Man, Reed Richards, Doctor Strange, Black Panther, Namor, Black Bolt and Beast — meeting in secret about the incursions. The two books trade off in blocks rather than issue by issue in this stretch, so nothing is tinted; the strict alternation starts in 005.",
      "items": [
        {
          "id": "001-new-avengers-1",
          "s": "New Avengers",
          "i": "#1",
          "note": "",
          "alt": false
        },
        {
          "id": "001-new-avengers-2",
          "s": "New Avengers",
          "i": "#2",
          "note": "",
          "alt": false
        },
        {
          "id": "001-new-avengers-3",
          "s": "New Avengers",
          "i": "#3",
          "note": "",
          "alt": false
        },
        {
          "id": "001-avengers-1",
          "s": "Avengers",
          "i": "#1",
          "note": "",
          "alt": false
        },
        {
          "id": "001-avengers-2",
          "s": "Avengers",
          "i": "#2",
          "note": "",
          "alt": false
        },
        {
          "id": "001-avengers-3",
          "s": "Avengers",
          "i": "#3",
          "note": "",
          "alt": false
        },
        {
          "id": "001-avengers-4",
          "s": "Avengers",
          "i": "#4",
          "note": "",
          "alt": false
        },
        {
          "id": "001-avengers-5",
          "s": "Avengers",
          "i": "#5",
          "note": "",
          "alt": false
        },
        {
          "id": "001-new-avengers-4",
          "s": "New Avengers",
          "i": "#4",
          "note": "",
          "alt": false
        },
        {
          "id": "001-new-avengers-5",
          "s": "New Avengers",
          "i": "#5",
          "note": "",
          "alt": false
        },
        {
          "id": "001-new-avengers-6",
          "s": "New Avengers",
          "i": "#6",
          "note": "",
          "alt": false
        },
        {
          "id": "001-avengers-6",
          "s": "Avengers",
          "i": "#6",
          "note": "",
          "alt": false
        },
        {
          "id": "001-avengers-7",
          "s": "Avengers",
          "i": "#7",
          "note": "",
          "alt": false
        },
        {
          "id": "001-avengers-8",
          "s": "Avengers",
          "i": "#8",
          "note": "",
          "alt": false
        },
        {
          "id": "001-avengers-9",
          "s": "Avengers",
          "i": "#9",
          "note": "",
          "alt": false
        },
        {
          "id": "001-avengers-10",
          "s": "Avengers",
          "i": "#10",
          "note": "",
          "alt": false
        },
        {
          "id": "001-avengers-11",
          "s": "Avengers",
          "i": "#11",
          "note": "",
          "alt": false
        },
        {
          "id": "001-avengers-12",
          "s": "Avengers",
          "i": "#12",
          "note": "",
          "alt": false
        },
        {
          "id": "001-avengers-13",
          "s": "Avengers",
          "i": "#13",
          "note": "",
          "alt": false
        },
        {
          "id": "001-new-avengers-7",
          "s": "New Avengers",
          "i": "#7",
          "note": "",
          "alt": false
        },
        {
          "id": "001-avengers-14",
          "s": "Avengers",
          "i": "#14",
          "note": "",
          "alt": false
        },
        {
          "id": "001-avengers-15",
          "s": "Avengers",
          "i": "#15",
          "note": "",
          "alt": false
        },
        {
          "id": "001-avengers-16",
          "s": "Avengers",
          "i": "#16",
          "note": "",
          "alt": false
        },
        {
          "id": "001-avengers-17",
          "s": "Avengers",
          "i": "#17",
          "note": "Leads straight into Infinity",
          "alt": false
        }
      ],
      "collected": "Avengers (2012 series) #1-44 and New Avengers (2013 series) #1-33 - check the year, both titles have been relaunched repeatedly. Avengers by Jonathan Hickman: The Complete Collection v1 (Avengers #1-5, New Avengers #1-6) and v2 (Avengers #6-17, New Avengers #7). As original trades: Avengers v1-3 (Avengers World / The Last White Event / Prelude to Infinity) and New Avengers v1-2 (Everything Dies / Infinity)."
    },
    {
      "id": "s-002",
      "n": "002",
      "title": "Infinity",
      "core": true,
      "flag": false,
      "note": "The six-issue event miniseries interleaves with both ongoings. This is the published reading order. Infinity is both a miniseries and a line-wide banner, which is the confusing part: the rows reading Infinity #1-6 are the actual miniseries, and the Avengers and New Avengers issues around them are the same continuous story rather than optional tie-ins. Read them in the order given or the event has holes in it. The opening row is a giveaway, officially Free Comic Book Day 2013 (Infinity) #1 — numbered #1 despite being a prologue to a different #1, and never sold. Against the Tide was digital-first, published as Infinite Comics rather than on paper.",
      "items": [
        {
          "id": "002-free-comic-book-day-2013-infinity-1",
          "s": "Free Comic Book Day 2013",
          "i": "Infinity #1",
          "note": "Hickman prologue",
          "alt": false
        },
        {
          "id": "002-infinity-1",
          "s": "Infinity",
          "i": "#1",
          "note": "",
          "alt": false
        },
        {
          "id": "002-new-avengers-8",
          "s": "New Avengers",
          "i": "#8",
          "note": "",
          "alt": false
        },
        {
          "id": "002-new-avengers-9",
          "s": "New Avengers",
          "i": "#9",
          "note": "",
          "alt": false
        },
        {
          "id": "002-avengers-18",
          "s": "Avengers",
          "i": "#18",
          "note": "",
          "alt": false
        },
        {
          "id": "002-infinity-2",
          "s": "Infinity",
          "i": "#2",
          "note": "",
          "alt": false
        },